<xs:schema xmlns:xs="http://www.w3.org/2001/XMLSchema"
	targetNamespace="https://github.com/alliedtelesis/apteryx"
	xmlns="https://github.com/alliedtelesis/apteryx"
	elementFormDefault="qualified">
	<xs:element name="VALUE">
		<xs:complexType>
			<xs:attribute name="name" type="xs:string" use="required" />
			<xs:attribute name="value" type="xs:string" use="required" />
			<xs:attribute name="help" type="xs:string" use="optional" />
		</xs:complexType>
	</xs:element>
	<xs:element name="PROVIDE">
	</xs:element>
	<xs:element name="INDEX">
	</xs:element>
	<xs:element name="WATCH">
	</xs:element>
	<xs:element name="REFRESH">
	</xs:element>
	<xs:element name="NODE">
		<xs:complexType>
			<xs:sequence>
				<xs:element ref="NODE" minOccurs="0" maxOccurs="unbounded" />
				<xs:element ref="VALUE" minOccurs="0" maxOccurs="unbounded" />
				<xs:element ref="WATCH" minOccurs="0" maxOccurs="1" />
				<xs:element ref="PROVIDE" minOccurs="0" maxOccurs="1" />
				<xs:element ref="INDEX" minOccurs="0" maxOccurs="1" />
				<xs:element ref="REFRESH" minOccurs="0" maxOccurs="1" />
			</xs:sequence>
			<xs:attribute name="name" use="required">
				<xs:simpleType>
					<xs:restriction base="xs:string">
						<xs:pattern value="[^_\s]*"/>
					</xs:restriction>
				</xs:simpleType>
			</xs:attribute>
			<xs:attribute name="default" type="xs:string" use="optional" />
			<xs:attribute name="pattern" type="xs:string" use="optional" />
			<xs:attribute name="range" type="xs:string" use="optional" />
			<xs:attribute name="key" type="xs:string" use="optional" />
			<xs:attribute name="unique" type="xs:string" use="optional" />
			<xs:attribute name="help" type="xs:string" use="optional" />
			<xs:attribute name="mode" use="optional">
				<xs:simpleType>
					<xs:restriction base="xs:string">
						<xs:pattern value="(p|x|hx|[rhwc]{1,4})"/>
					</xs:restriction>
				</xs:simpleType>
			</xs:attribute>
		</xs:complexType>
	</xs:element>
	<xs:element name="SCRIPT">
	</xs:element>
	<xs:element name="MODULE">
		<xs:complexType>
			<xs:sequence>
				<xs:element ref="SCRIPT" minOccurs="0" maxOccurs="unbounded"/>
				<xs:element ref="NODE" minOccurs="0" maxOccurs="unbounded"/>
			</xs:sequence>
			<xs:attribute name="model" type="xs:string" use="optional" />
			<xs:attribute name="namespace" type="xs:string" use="optional" />
			<xs:attribute name="prefix" type="xs:string" use="optional" />
			<xs:attribute name="organization" type="xs:string" use="optional" />
			<xs:attribute name="version" type="xs:string" use="optional" />
		</xs:complexType>
	</xs:element>
</xs:schema>
