<?xml version='1.0' encoding='UTF-8'?>
<MODULE xmlns="http://test.com/ns/yang/xlat-testing"
    xmlns:xlat-test="http://test.com/ns/yang/xlat-testing"
    xmlns:xsi="http://www.w3.org/2001/XMLSchema-instance"
    xsi:schemaLocation="https://github.com/alliedtelesis/apteryx-xml https://github.com/alliedtelesis/apteryx-xml/releases/download/v1.2/apteryx.xsd"
    model="xlat-test" organization="Test Ltd" version="2023-01-01">
    <NODE name="xlat-test" help="This is a test node">
        <NODE name="xlat-animals">
            <NODE name="xlat-animal" help="This is a list of animals">
                <NODE name="*" help="The animal entry with key name">
                    <NODE name="name" mode="rw" help="This is the name of the animal" />
                    <NODE name="type" mode="rw" default="big" help="This is the type of the animal">
                        <VALUE name="fast" value="3" />
                        <VALUE name="slow" value="4" />
                    </NODE>
                    <NODE name="colour" mode="rw" help="This is the colour of the animal" />
                    <NODE name="food">
                        <NODE name="*" help="This is a list of food">
                            <NODE name="name" mode="rw" help="Food name" />
                            <NODE name="type" mode="rw" help="Food type" />
                        </NODE>
                    </NODE>
                    <NODE name="toys">
                        <NODE name="toy" help="This is a leaf list of toys">
                            <NODE name="*" mode="rw" help="List of toys" />
                        </NODE>
                    </NODE>
                </NODE>
            </NODE>
        </NODE>
    </NODE>
</MODULE>