<?xml version='1.0' encoding='UTF-8'?>
<MODULE xmlns="http://test.com/ns/yang/testing-2" 
        xmlns:t2="http://test.com/ns/yang/testing-2"
        xmlns:xsi="http://www.w3.org/2001/XMLSchema-instance"
        xsi:schemaLocation="https://github.com/alliedtelesis/apteryx-xml https://github.com/alliedtelesis/apteryx-xml/releases/download/v1.2/apteryx.xsd"
        model="testing-2" organization="Test 2 Ltd" version="2023-02-01">
  <NODE name="test" help="This is a test node">
    <NODE name="settings" help="Settings">
      <NODE name="priority" mode="rw" help="integer" range="1..5"/>
      <NODE name="users" help="This is a list of users">
        <NODE name="*" help="The user entry with key name">
          <NODE name="name" mode="rw" help="This is the name of the user"/>
        </NODE>
      </NODE>
    </NODE>
    <NODE name="state" help="State">
      <NODE name="priority" mode="r" help="integer"/>
    </NODE>
  </NODE>
</MODULE>
